{
  "id": "recipe-setup-memory-search",
  "type": "recipe",
  "version": "1.0.0",
  "metadata": {
    "name": "启用记忆搜索",
    "description": "配置向量搜索让 AI 助手能检索历史对话和知识文件，实现长期记忆",
    "category": "setup",
    "tags": ["memory", "search", "vector", "embedding", "semantic"],
    "difficulty": "medium",
    "i18n": {
      "en": {
        "name": "Enable Memory Search",
        "description": "Configure vector search so your AI can retrieve past conversations and knowledge files for long-term memory"
      }
    }
  },
  "content": {
    "body": "记忆搜索（Memory Search）让 AI 助手可以通过语义检索查找历史对话和知识文件中的相关内容。这是实现「AI 不会忘事」的关键功能。\n\n**工作原理：**\n1. HermesAgent 将 MEMORY.md、历史会话等内容转化为向量嵌入（embedding）\n2. 用户提问时，系统自动搜索语义最相关的记忆片段\n3. 找到的内容注入到 AI 的上下文中，帮助 AI 给出更准确的回答\n\n**支持的嵌入提供商：** OpenAI、Google Gemini、Voyage、Mistral、Ollama（本地）",
    "steps": [
      {
        "title": "启用记忆搜索",
        "description": "前往「配置中心 → 记忆」→ 打开「启用记忆搜索」开关。"
      },
      {
        "title": "选择嵌入提供商",
        "description": "在「嵌入提供商」下拉列表中选择：\n- **openai** — 使用 OpenAI 的 text-embedding 模型（需要 API Key）\n- **gemini** — 使用 Google 的嵌入模型\n- **local** — 使用本地模型（无需 API Key，但效果略逊）\n- **ollama** — 使用本地 Ollama 推理\n推荐新用户选择 openai，效果最好。如果已有 OpenAI 提供商，会自动复用其 API Key。"
      },
      {
        "title": "配置搜索范围",
        "description": "在 sources 中选择要搜索的内容来源：\n- **memory** — 搜索 MEMORY.md 文件内容\n- **sessions** — 搜索历史会话记录\n建议两者都勾选，获得最佳记忆效果。"
      },
      {
        "title": "调整查询参数（可选）",
        "description": "高级用户可以调整：\n- maxResults — 每次搜索返回的最大结果数（默认 5）\n- minScore — 最低相关性阈值（0-1，默认 0.3）\n- hybrid.enabled — 启用混合搜索（向量 + 关键词），提高召回率"
      },
      {
        "title": "保存并验证",
        "description": "保存配置后，在聊天中提及之前对话过的内容，观察 AI 是否能回忆起来。首次启用可能需要等待索引构建完成（几分钟到十几分钟不等，取决于历史数据量）。"
      }
    ],
    "editorSection": "memory"
  }
}
