{
  "id": "faq-model-not-responding",
  "type": "faq",
  "version": "1.0.0",
  "metadata": {
    "name": "模型无响应",
    "description": "排查 AI 模型不回复、回复超时或返回错误的常见问题",
    "category": "troubleshooting",
    "tags": ["model", "provider", "apikey", "timeout", "error", "troubleshooting"],
    "difficulty": "easy",
    "i18n": {
      "en": {
        "name": "Model Not Responding",
        "description": "Troubleshoot when the AI model doesn't reply, times out or returns errors"
      }
    }
  },
  "content": {
    "question": "AI 模型不回复或返回错误怎么办？",
    "answer": "## 排查步骤\n\n### 1. 检查提供商连接\n前往「配置中心 → 模型」，找到你的提供商，点击「测试连接」按钮：\n- ✅ 连接成功 → 提供商正常，问题在其他地方\n- ❌ 连接失败 → 检查 API Key 是否正确、是否过期\n\n### 2. 检查 API Key\n- 确认 API Key 没有过期或被撤销\n- 确认账户余额充足（很多提供商余额为 0 时会拒绝请求）\n- 尝试在提供商官网的 Playground 中测试同一个 Key\n\n### 3. 检查网络连接\n- 确认你的网络可以访问提供商的 API 地址\n- 如果在中国大陆，部分提供商（OpenAI、Anthropic）需要代理\n- 检查是否设置了正确的 Base URL（自定义代理地址）\n\n### 4. 检查模型名称\n- 确认主模型名称拼写正确（区分大小写）\n- 部分提供商的模型名称可能已更新（如 gpt-4-turbo → gpt-4o）\n- 在「配置中心 → 模型」中点击「发现模型」获取最新模型列表\n\n### 5. 检查限流（Rate Limit）\n- 如果错误信息包含 429 或 rate_limit，说明请求频率过高\n- 解决方案：配置备用模型（fallbacks），让 HermesAgent 自动切换\n- 或减少心跳频率：「配置中心 → 代理 → 心跳 → every」增大间隔\n\n### 6. 检查超时\n- 如果模型响应很慢，可能是模型繁忙\n- 前往「配置中心 → 代理」→ 增大 timeoutSeconds 值（默认 120 秒）\n\n## 快速修复\n\n1. 运行「健康中心」诊断，查看模型相关的检查项\n2. 确认至少配置了一个备用模型（「配置中心 → 模型 → 备用模型」）\n3. 如果问题持续，切换到另一个提供商的模型",
    "relatedDoctorChecks": ["provider.health", "apiKey.valid", "model.primary"],
    "editorSection": "models"
  }
}
