{
  "id": "tip-logging-debugging",
  "type": "tip",
  "version": "1.0.0",
  "metadata": {
    "name": "日志与调试",
    "description": "配置日志级别、输出格式和诊断工具，高效排查 HermesAgent 运行问题",
    "category": "maintenance",
    "tags": ["logging", "debug", "diagnostics", "troubleshooting", "otel"],
    "difficulty": "medium",
    "i18n": {
      "en": {
        "name": "Logging & Debugging",
        "description": "Configure log levels, output formats and diagnostic tools for efficient HermesAgent troubleshooting"
      }
    }
  },
  "content": {
    "body": "## 日志配置\n\n当 HermesAgent 出现异常行为时，日志是排查问题的第一工具。\n\n### 在 HermesDeckX 中配置\n\n前往「配置中心 → 日志」：\n\n### 日志级别\n\n| 级别 | 说明 | 适用场景 |\n|------|------|----------|\n| **silent** | 不输出日志 | 不推荐 |\n| **error** | 仅错误 | 生产环境 |\n| **warn** | 错误 + 警告 | 生产环境（推荐） |\n| **info** | 包含运行信息 | 日常使用（默认） |\n| **debug** | 包含调试信息 | 排查问题时临时启用 |\n| **trace** | 最详细 | 深度排查（会产生大量日志） |\n\n### 控制台输出格式\n\n- **pretty** — 彩色格式化输出（开发环境推荐）\n- **compact** — 紧凑输出（生产环境推荐）\n- **json** — JSON 格式（便于日志收集系统解析）\n\n### 文件日志\n\n- **file** — 日志文件路径\n- **maxFileBytes** — 日志文件最大大小（超过后自动轮转）\n\n## 诊断工具\n\n前往「配置中心 → 日志 → 诊断」：\n\n### 卡顿检测\n\n- **stuckSessionWarnMs** — 会话处理超过此时间（毫秒）发出警告\n\n### OpenTelemetry（高级）\n\n如果你使用 Grafana、Jaeger 等可观测性平台，可以启用 OTEL 集成：\n- **otel.enabled** — 启用 OTEL\n- **otel.endpoint** — 收集器地址\n- **otel.traces/metrics/logs** — 分别控制链路追踪、指标、日志的导出\n\n### 缓存追踪\n\n启用 `cacheTrace` 可以记录每次 AI 请求的完整提示词和响应，用于分析 AI 行为：\n- **cacheTrace.enabled** — 启用\n- **cacheTrace.includeMessages** — 包含对话消息\n- **cacheTrace.includePrompt** — 包含系统提示\n\n## 敏感信息保护\n\n- **redactSensitive** — 设为 `tools` 可以在日志中隐藏工具调用的敏感参数\n- **redactPatterns** — 自定义脱敏正则表达式\n\n## 配置字段\n\n对应配置路径：`logging` 和 `diagnostics`",
    "editorSection": "logging"
  }
}
